{
  "schema_version": "projection_health_receipt_v1",
  "receipt_id": "kag:health:return-regrounding-pack:2026-04-13T13:05:00Z",
  "timestamp_utc": "2026-04-13T13:05:00Z",
  "repo": "aoa-kag",
  "projection_family": "return_regrounding_pack",
  "projection_id": "return-regrounding-pack:runtime-chaos-retrieval-outage-honesty",
  "bounded_scope": {
    "kind": "projection",
    "value": "mechanics/recurrence/parts/return-regrounding/generated/return_regrounding_pack.min.json",
    "notes": "Derived source-first return pack used when runtime-chaos retrieval posture must reground callers back to stronger playbook and eval refs."
  },
  "donor_roots": [
    "AOA_PLAYBOOKS_ROOT",
    "AOA_EVALS_ROOT"
  ],
  "symptom_class": "upstream_retrieval_unavailable",
  "severity": "high",
  "health_state": "quarantined",
  "consumer_posture": "source_first",
  "validator_refs": [
    "python scripts/validate_kag.py#retrieval-outage-honesty-contract",
    "python scripts/validate_nested_agents.py#retrieval-outage-honesty-contract"
  ],
  "affected_generated_surfaces": [
    "mechanics/recurrence/parts/return-regrounding/generated/return_regrounding_pack.min.json",
    "mechanics/checkpoint/parts/reasoning-handoff/generated/reasoning_handoff_pack.min.json"
  ],
  "evidence_refs": [
    "aoa-playbooks/mechanics/antifragility/parts/stress-lanes/examples/playbook_stress_lane.retrieval-outage-honesty.example.json",
    "aoa-playbooks/mechanics/antifragility/parts/reentry-gates/examples/playbook_reentry_gate.retrieval-outage-honesty.example.json"
  ],
  "source_fallback_refs": [
    "aoa-playbooks/playbooks/operations/recovery/runtime-chaos-recovery/PLAYBOOK.md",
    "aoa-evals/mechanics/audit/parts/artifact-verdict-hooks/docs/TRACE_EVAL_BRIDGE.md",
    "mechanics/recurrence/parts/return-regrounding/docs/recurrence-regrounding.md"
  ],
  "notes": "Consumers should prefer source-first posture until the return and handoff packs validate again for the affected route.",
  "supersedes": []
}
